"title","link","location","date","body","test"
"Marina asegura más de 2,800 kilogramos de presunta cocaína y combustible; asimismo, detiene a tres personas en Guerrero y Quintana Roo","https://www.gob.mx/semar/prensa/marina-asegura-mas-de-2-800-kilogramos-de-presunta-cocaina-y-aproximadamente-150-litros-de-combustible-asimismo-detiene-a-tres-presuntos-trasgresores-de-la-ley-en-costas-de-guerrero-y-quintana-roo?idiom=es","Ciudad de México","15 de agosto","En un primer evento, personal adscrito a la Décima Segunda Región Naval, con sede en Acapulco, Guerrero, logró el aseguramiento de 80 bultos con aproximadamente 2,779.42 (dos mil setecientos setenta y nueve punto cuarenta y dos) kilogramos de presunto clorhidrato de cocaína, tres bidones con aproximadamente 150 (ciento cincuenta) litros de combustible; así como la detención de tres presuntos transgresores de la ley. En un primer evento, personal adscrito a la Décima Segunda Región Naval, con sede en Acapulco, Guerrero, logró el aseguramiento de 80 bultos con aproximadamente 2,779.42 (dos mil setecientos setenta y nueve punto cuarenta y dos) kilogramos de presunto clorhidrato de cocaína, tres bidones con aproximadamente 150 (ciento cincuenta) litros de combustible; así como la detención de tres presuntos transgresores de la ley.Esta acción se llevó a cabo tras efectuar patrullajes de vigilancia marítima con una Patrulla Oceánica de la Armada de México, localizando una embarcación menor con dos motores fuera de borda, a aproximadamente 194 millas náuticas (359 kilómetros) al Sureste del puerto de Acapulco, Guerrero, con tres tripulantes a bordo, logrando el aseguramiento de la presunta droga y combustible, distribuido en diferentes contenedores. Esta acción se llevó a cabo tras efectuar patrullajes de vigilancia marítima con una Patrulla Oceánica de la Armada de México, localizando una embarcación menor con dos motores fuera de borda, a aproximadamente 194 millas náuticas (359 kilómetros) al Sureste del puerto de Acapulco, Guerrero, con tres tripulantes a bordo, logrando el aseguramiento de la presunta droga y combustible, distribuido en diferentes contenedores.En un segundo evento, personal adscrito a la Novena Región Naval y a la Décima Quinta Zona Naval, con sede en Islas Mujeres, Quintana Roo y Cozumel, Quintana, Roo, respectivamente, durante recorridos de patrullaje de vigilancia terrestre en la línea de costa en la Playa Punta Piedra, localizó y aseguró 18 paquetes tipo ladrillo envueltos en cinta negra, conteniendo en su interior sustancia con las características similares a la cocaína con un peso aproximado de 18.576 (dieciocho punto quinientos setenta y seis) kilogramos. En un segundo evento, personal adscrito a la Novena Región Naval y a la Décima Quinta Zona Naval, con sede en Islas Mujeres, Quintana Roo y Cozumel, Quintana, Roo, respectivamente, durante recorridos de patrullaje de vigilancia terrestre en la línea de costa en la Playa Punta Piedra, localizó y aseguró 18 paquetes tipo ladrillo envueltos en cinta negra, conteniendo en su interior sustancia con las características similares a la cocaína con un peso aproximado de 18.576 (dieciocho punto quinientos setenta y seis) kilogramos.Finalmente, en un tercer evento también en las costas de Quintana Roo, personal de esta Institución, durante patrullaje aéreo costero, avistó un bulto blanco flotando sobre el sargazo a aproximadamente 100 metros de la playa de Akumal; por lo anterior, se ordenó a una embarcación de la Armada de México que efectuaba patrullaje de vigilancia marítima, dirigirse al lugar donde se encontraba dicho objeto flotando. Finalmente, en un tercer evento también en las costas de Quintana Roo, personal de esta Institución, durante patrullaje aéreo costero, avistó un bulto blanco flotando sobre el sargazo a aproximadamente 100 metros de la playa de Akumal; por lo anterior, se ordenó a una embarcación de la Armada de México que efectuaba patrullaje de vigilancia marítima, dirigirse al lugar donde se encontraba dicho objeto flotando.La presunta carga ilícita fue trasladada a la Estación Naval de Playa del Carmen, donde se le efectuó una inspección, encontrando 25 paquetes tipo ladrillo, conteniendo en su interior sustancia con las características similares a las de la cocaína con un peso aproximado de 25.046 (veinticinco punto cuarenta y seis) kilogramos. La presunta carga ilícita fue trasladada a la Estación Naval de Playa del Carmen, donde se le efectuó una inspección, encontrando 25 paquetes tipo ladrillo, conteniendo en su interior sustancia con las características similares a las de la cocaína con un peso aproximado de 25.046 (veinticinco punto cuarenta y seis) kilogramos.En estos eventos, las personas detenidas, a quienes se les leyeron sus Derechos Humanos, la presunta droga y combustible asegurados, fueron puestos a disposición de las autoridades competentes, para integrar la carpeta de investigación correspondiente; la embarcación por las condiciones meteorológicas adversas, al ser remolcada, se dio fondo en la mar. En estos eventos, las personas detenidas, a quienes se les leyeron sus Derechos Humanos, la presunta droga y combustible asegurados, fueron puestos a disposición de las autoridades competentes, para integrar la carpeta de investigación correspondiente; la embarcación por las condiciones meteorológicas adversas, al ser remolcada, se dio fondo en la mar.Es importante mencionar que lo anterior se llevó a cabo con base en el Protocolo de Actuación del Personal Naval en funciones de Guardia Costera, publicado en el Diario Oficial de la Federación el 06 de abril de 2018, donde se atribuye la participación del personal de la Secretaría de Marina a través de la Armada de México en el desempeño de sus funciones, actuando de manera coordinada con unidades aéreas, terrestres y de superficie, así como con las autoridades competentes, de conformidad a lo establecido en la Ley Nacional sobre el Uso de la Fuerza y en estricto respeto a los Derechos Humanos. Es importante mencionar que lo anterior se llevó a cabo con base en el Protocolo de Actuación del Personal Naval en funciones de Guardia Costera, publicado en el Diario Oficial de la Federación el 06 de abril de 2018, donde se atribuye la participación del personal de la Secretaría de Marina a través de la Armada de México en el desempeño de sus funciones, actuando de manera coordinada con unidades aéreas, terrestres y de superficie, así como con las autoridades competentes, de conformidad a lo establecido en la Ley Nacional sobre el Uso de la Fuerza y en estricto respeto a los Derechos Humanos.Estas acciones son parte de las operaciones de vigilancia marítimas, aéreas y terrestres que efectúa la Secretaría de Marina a través de la Armada de México en aguas nacionales, para inhibir la acción delincuencial con el fin de garantizar y mantener el Estado de Derecho en las Zonas Marinas Mexicanas. Estas acciones son parte de las operaciones de vigilancia marítimas, aéreas y terrestres que efectúa la Secretaría de Marina a través de la Armada de México en aguas nacionales, para inhibir la acción delincuencial con el fin de garantizar y mantener el Estado de Derecho en las Zonas Marinas Mexicanas. ARMADA DE MÉXICO  ARMADA DE MÉXICO-EN EL MAR, EN EL AIRE, EN LA TIERRA- -EN EL MAR, EN EL AIRE, EN LA TIERRA-Puedes seleccionar más de uno. Puedes seleccionar más de uno.Puedes seleccionar más de una opción. Puedes seleccionar más de una opción.Gracias por tu opinión. Gracias por tu opinión.La legalidad, veracidad y la calidad de la información es estricta responsabilidad de la dependencia, entidad o empresa productiva del Estado que la proporcionó en virtud de sus atribuciones y/o facultades normativas. La legalidad, veracidad y la calidad de la información es estricta responsabilidad de la dependencia, entidad o empresa productiva del Estado que la proporcionó en virtud de sus atribuciones y/o facultades normativas.Es el portal único de trámites, información y participación ciudadana. Leer más Es el portal único de trámites, información y participación ciudadana. Leer más",NA
"Se destruyen más de 15,000 metros de redes de pesca recuperadas en la Zona de Refugio para la protección de la vaquita marina","https://www.gob.mx/semar/prensa/se-destruyen-mas-de-15-000-metros-de-redes-de-pesca-recuperadas-en-la-zona-de-refugio-para-la-proteccion-de-la-vaquita-marina-342228?idiom=es","-ooOoo-",NA,"La acción coordinada por personal del Mando Naval de la entidad, se realizó mediante el empleo de una máquina trituradora para el reciclado de redes de pesca, que fue donada en 2019 por la Sea Shepherd Conservation Society, conforme al convenio de colaboración vigente. La acción coordinada por personal del Mando Naval de la entidad, se realizó mediante el empleo de una máquina trituradora para el reciclado de redes de pesca, que fue donada en 2019 por la Sea Shepherd Conservation Society, conforme al convenio de colaboración vigente.Con lo anterior, se busca reemplazar el método tradicional de destrucción por incineración por otro más amigable con el medio ambiente, el cual permita el reciclaje de los materiales producto de la destrucción. Con lo anterior, se busca reemplazar el método tradicional de destrucción por incineración por otro más amigable con el medio ambiente, el cual permita el reciclaje de los materiales producto de la destrucción.Las redes de pesca abandonadas o perdidas, también conocidas como redes fantasma, constituyen una amenaza para la biodiversidad marina y, sobre todo, para la preservación de la vaquita marina, especie endémica del Alto Golfo de California en peligro de extinción. Las redes de pesca abandonadas o perdidas, también conocidas como redes fantasma, constituyen una amenaza para la biodiversidad marina y, sobre todo, para la preservación de la vaquita marina, especie endémica del Alto Golfo de California en peligro de extinción.Con estas acciones, el Gobierno de México refrenda el compromiso del trabajo realizado por el Grupo Intragubernamental sobre la Sustentabilidad en el Alto Golfo de California (GIS), para evitar la pesca ilegal de totoaba y proteger a la vaquita marina de las redes de enmalle. Con estas acciones, el Gobierno de México refrenda el compromiso del trabajo realizado por el Grupo Intragubernamental sobre la Sustentabilidad en el Alto Golfo de California (GIS), para evitar la pesca ilegal de totoaba y proteger a la vaquita marina de las redes de enmalle.Asimismo, se garantiza el cumplimiento de lo establecido en la meta 2.7: Destruir todas las redes encontradas en el Área de Tolerancia Cero (Zo) del “Plan de Acción del Gobierno de México para prevenir la Pesca Ilegal de Totoaba, sus partes y/o derivados, en Protección a la Vaquita Marina”, aprobado por la Convención sobre el Comercio Internacional de Especies Amenazadas de Fauna y Flora Silvestres (CITES). Asimismo, se garantiza el cumplimiento de lo establecido en la meta 2.7: Destruir todas las redes encontradas en el Área de Tolerancia Cero (Zo) del “Plan de Acción del Gobierno de México para prevenir la Pesca Ilegal de Totoaba, sus partes y/o derivados, en Protección a la Vaquita Marina”, aprobado por la Convención sobre el Comercio Internacional de Especies Amenazadas de Fauna y Flora Silvestres (CITES).-ooOoo- -ooOoo-Puedes seleccionar más de uno. Puedes seleccionar más de uno.Puedes seleccionar más de una opción. Puedes seleccionar más de una opción.Gracias por tu opinión. Gracias por tu opinión.La legalidad, veracidad y la calidad de la información es estricta responsabilidad de la dependencia, entidad o empresa productiva del Estado que la proporcionó en virtud de sus atribuciones y/o facultades normativas. La legalidad, veracidad y la calidad de la información es estricta responsabilidad de la dependencia, entidad o empresa productiva del Estado que la proporcionó en virtud de sus atribuciones y/o facultades normativas.Es el portal único de trámites, información y participación ciudadana. Leer más Es el portal único de trámites, información y participación ciudadana. Leer más",NA
"La Marina a través de la Armada de México logra la localización y  desmantelamiento de 104 laboratorios clandestinos.","https://www.gob.mx/semar/prensa/secretaria-de-marina-a-traves-de-la-armada-de-mexico-logra-la-localizacion-y-desmantelamiento-de-104-laboratorios-clandestinos?idiom=es","Ciudad de México","11 de agosto","Estas acciones son resultado de operativos efectuados por elementos de la Armada de México en coordinación con personal de la Fiscalía General de la República, que permitieron en días pasados, alcanzar citada cifra, con la localización y desmantelamiento de cuatro laboratorios clandestinos en inmediaciones de los poblados ""La Higuerita"" y ""El Gachupín"" del municipio de Culiacán, Sinaloa, donde fueron localizados aproximadamente 12,980 (doce mil novecientos ochenta) kilogramos de presunta metanfetamina y 11,205 (once mil doscientos cinco) kilogramos de precursores químicos; de igual manera, fue decomisado material diverso para la elaboración de drogas sintéticas. Estas acciones son resultado de operativos efectuados por elementos de la Armada de México en coordinación con personal de la Fiscalía General de la República, que permitieron en días pasados, alcanzar citada cifra, con la localización y desmantelamiento de cuatro laboratorios clandestinos en inmediaciones de los poblados ""La Higuerita"" y ""El Gachupín"" del municipio de Culiacán, Sinaloa, donde fueron localizados aproximadamente 12,980 (doce mil novecientos ochenta) kilogramos de presunta metanfetamina y 11,205 (once mil doscientos cinco) kilogramos de precursores químicos; de igual manera, fue decomisado material diverso para la elaboración de drogas sintéticas.Asimismo, en el estado de Durango, se localizaron e inhabilitaron cuatro laboratorios más, en inmediaciones de los poblados “Carricitos” y “Los Otates”, asegurando 25,218 (veinticinco mil doscientos dieciocho) kilogramos de presunta metanfetamina y 9,805 (nueve mil ochocientos cinco) kilogramos de precursores químicos, así como material diverso para la elaboración de mencionadas drogas. Asimismo, en el estado de Durango, se localizaron e inhabilitaron cuatro laboratorios más, en inmediaciones de los poblados “Carricitos” y “Los Otates”, asegurando 25,218 (veinticinco mil doscientos dieciocho) kilogramos de presunta metanfetamina y 9,805 (nueve mil ochocientos cinco) kilogramos de precursores químicos, así como material diverso para la elaboración de mencionadas drogas.Cabe destacar, que en el presente año, se han asegurado y destruido un total de 104 laboratorios clandestinos, 319 reactores, 70 condensadores, sumando más de 180 (ciento ochenta) toneladas de metanfetamina y más de 318 (trescientos dieciocho) toneladas de precursores químicos. Cabe destacar, que en el presente año, se han asegurado y destruido un total de 104 laboratorios clandestinos, 319 reactores, 70 condensadores, sumando más de 180 (ciento ochenta) toneladas de metanfetamina y más de 318 (trescientos dieciocho) toneladas de precursores químicos.Por lo anterior, los laboratorios, presunta metanfetamina, precursores químicos y material diverso, fueron destruidos en el lugar, con previa autorización de la autoridad ministerial competente, para la integración de la carpeta de investigación correspondiente. Por lo anterior, los laboratorios, presunta metanfetamina, precursores químicos y material diverso, fueron destruidos en el lugar, con previa autorización de la autoridad ministerial competente, para la integración de la carpeta de investigación correspondiente.Es importante mencionar, que la localización y posterior destrucción de estos laboratorios, ha sido posible, gracias a la tecnología de vanguardia con la que están equipadas las aeronaves de ala fija de la institución, entre la que se puede mencionar equipos de visión nocturna e infrarrojos. Es importante mencionar, que la localización y posterior destrucción de estos laboratorios, ha sido posible, gracias a la tecnología de vanguardia con la que están equipadas las aeronaves de ala fija de la institución, entre la que se puede mencionar equipos de visión nocturna e infrarrojos. En este contexto, la Secretaría de Marina ha rediseñado su estrategia, haciendo uso de helicópteros para llevar a cabo la inserción de equipo y personal especializado en el manejo de sustancias químicas y explosivos, además del personal que proporciona seguridad perimetral durante las tareas de destrucción. De igual manera, el éxito obtenido en la implementación de esta estrategia ha permitido un incremento del 500% en la destrucción de laboratorios, en comparación con los cuatro años anteriores, lográndose aseguramientos relevantes.  En este contexto, la Secretaría de Marina ha rediseñado su estrategia, haciendo uso de helicópteros para llevar a cabo la inserción de equipo y personal especializado en el manejo de sustancias químicas y explosivos, además del personal que proporciona seguridad perimetral durante las tareas de destrucción. De igual manera, el éxito obtenido en la implementación de esta estrategia ha permitido un incremento del 500% en la destrucción de laboratorios, en comparación con los cuatro años anteriores, lográndose aseguramientos relevantes.Considerando los costos promedio de las ventas no realizadas, sumado a los costos de precursores y sustancias básicas, material inhabilitado y la metanfetamina destruida, se calcula que la afectación a la delincuencia organizada es superior a los 85 millones de dólares. Considerando los costos promedio de las ventas no realizadas, sumado a los costos de precursores y sustancias básicas, material inhabilitado y la metanfetamina destruida, se calcula que la afectación a la delincuencia organizada es superior a los 85 millones de dólares.Estos resultados reflejan el alto nivel de compromiso de la Secretaría de Marina en contra del tráfico y la producción de sustancias ilícitas, lo cual queda demostrado a través de acciones contundentes que se materializan en un aumento constante del número de laboratorios clandestinos destruidos, que se caracterizan por ser realizadas por personal naval capacitado y entrenado, además de contar con un equipamiento cada vez más sofisticado. Estos resultados reflejan el alto nivel de compromiso de la Secretaría de Marina en contra del tráfico y la producción de sustancias ilícitas, lo cual queda demostrado a través de acciones contundentes que se materializan en un aumento constante del número de laboratorios clandestinos destruidos, que se caracterizan por ser realizadas por personal naval capacitado y entrenado, además de contar con un equipamiento cada vez más sofisticado.Con estas acciones la Secretaría de Marina a través de la Armada de México, contribuye en la suma de esfuerzos para combatir las conductas delictivas, traducidas tanto en el establecimiento de laboratorios clandestinos, como en la elaboración de drogas sintéticas en nuestro país, debilitando con ello la producción y distribución de drogas por parte de grupos delictivos. Con estas acciones la Secretaría de Marina a través de la Armada de México, contribuye en la suma de esfuerzos para combatir las conductas delictivas, traducidas tanto en el establecimiento de laboratorios clandestinos, como en la elaboración de drogas sintéticas en nuestro país, debilitando con ello la producción y distribución de drogas por parte de grupos delictivos.ARMADA DE MÉXICO ARMADA DE MÉXICO-EN EL MAR, EN EL AIRE, EN LA TIERRA- -EN EL MAR, EN EL AIRE, EN LA TIERRA-Puedes seleccionar más de uno. Puedes seleccionar más de uno.Puedes seleccionar más de una opción. Puedes seleccionar más de una opción.Gracias por tu opinión. Gracias por tu opinión.La legalidad, veracidad y la calidad de la información es estricta responsabilidad de la dependencia, entidad o empresa productiva del Estado que la proporcionó en virtud de sus atribuciones y/o facultades normativas. La legalidad, veracidad y la calidad de la información es estricta responsabilidad de la dependencia, entidad o empresa productiva del Estado que la proporcionó en virtud de sus atribuciones y/o facultades normativas.Es el portal único de trámites, información y participación ciudadana. Leer más Es el portal único de trámites, información y participación ciudadana. Leer más",NA
