"title","link","location","date","body","test"
"Marina despliega más de 2 mil elementos durante la implementación de Plan Marina en la península de Baja California.","https://www.gob.mx/semar/prensa/marina-despliega-mas-de-2-mil-elementos-durante-la-implementacion-de-plan-marina-en-la-peninsula-de-baja-california?idiom=es","Ciudad de México","20 de agosto"," Cabe destacar que, 2 mil 728 elementos pertenecientes a esta Institución se encuentran brindando apoyo a través del Plan Marina, en las localidades de Bahía Tortuga, Loreto, Punta Abreojos, Guerrero Negro, San Ignacio, Vizcaíno, Santa Rosalía y Mulegé.  Cabe destacar que, 2 mil 728 elementos pertenecientes a esta Institución se encuentran brindando apoyo a través del Plan Marina, en las localidades de Bahía Tortuga, Loreto, Punta Abreojos, Guerrero Negro, San Ignacio, Vizcaíno, Santa Rosalía y Mulegé.Asimismo, se han desplegado tres buques, 35 embarcaciones menores, 138 vehículos, siete ambulancias, una cocina móvil, dos plantas potabilizadoras, dos aviones y cuatro helicópteros de la Armada de México, para auxiliar a la población civil en las zonas de desastre. Asimismo, se han desplegado tres buques, 35 embarcaciones menores, 138 vehículos, siete ambulancias, una cocina móvil, dos plantas potabilizadoras, dos aviones y cuatro helicópteros de la Armada de México, para auxiliar a la población civil en las zonas de desastre. Entre los diversos apoyos que el personal naval mantiene en citados municipios, es importante mencionar que brigadistas de esta Secretaría de Marina, rescataron siete adultos y seis menores que se encontraban en áreas consideradas de alto riesgo para la vida, por la presencia de deslaves y la fuerte corriente del principal arroyo de la zona.  Entre los diversos apoyos que el personal naval mantiene en citados municipios, es importante mencionar que brigadistas de esta Secretaría de Marina, rescataron siete adultos y seis menores que se encontraban en áreas consideradas de alto riesgo para la vida, por la presencia de deslaves y la fuerte corriente del principal arroyo de la zona.Aunado a ello, se brindó apoyo a autoridades civiles y militares durante el desbordamiento del arroyo San Pablo, en la localidad de Vizcaino, rescatando a la Presidenta Municipal de Mulegé, al Coordinador de Protección Civil del estado de Baja California Sur, al General Comandante de la 40 Zona Militar, un Coronel y dos escoltas. Aunado a ello, se brindó apoyo a autoridades civiles y militares durante el desbordamiento del arroyo San Pablo, en la localidad de Vizcaino, rescatando a la Presidenta Municipal de Mulegé, al Coordinador de Protección Civil del estado de Baja California Sur, al General Comandante de la 40 Zona Militar, un Coronel y dos escoltas.Bajo este contexto, 250 elementos especializados en protección civil se encuentran brindando diversos apoyos entre la ciudadanía; de igual manera, se están entregando más 3 mil despensas por parte de esta Institución y aproximadamente 1,800 despensas que fueron donadas por la población civil, asi como, más de 24 mil litros de agua embotellada. Bajo este contexto, 250 elementos especializados en protección civil se encuentran brindando diversos apoyos entre la ciudadanía; de igual manera, se están entregando más 3 mil despensas por parte de esta Institución y aproximadamente 1,800 despensas que fueron donadas por la población civil, asi como, más de 24 mil litros de agua embotellada.Es importante hacer mención que el Plan Marina forma parte del Programa Nacional de Protección Civil y efectúa labores de alistamiento con los grupos de apoyo móvil de la Armada de México, en coordinación con autoridades de los tres órdenes de Gobierno y del sector privado. Es importante hacer mención que el Plan Marina forma parte del Programa Nacional de Protección Civil y efectúa labores de alistamiento con los grupos de apoyo móvil de la Armada de México, en coordinación con autoridades de los tres órdenes de Gobierno y del sector privado.La Secretaría de Marina a través de la Armada de México, reitera su compromiso con la ciudadanía de velar por su integridad, disponiendo para tal fin todos sus recursos humanos y materiales, a través de la implementación del Plan Marina; por ello, continuará trabajando en apoyo a las familias afectadas por los fenómenos meteorológicos en la península de Baja California. La Secretaría de Marina a través de la Armada de México, reitera su compromiso con la ciudadanía de velar por su integridad, disponiendo para tal fin todos sus recursos humanos y materiales, a través de la implementación del Plan Marina; por ello, continuará trabajando en apoyo a las familias afectadas por los fenómenos meteorológicos en la península de Baja California.Esta Institución hace un llamado a todas las personas para atender las recomendaciones de las autoridades de Protección Civil y pone a disposición el número telefónico 800 MARINA 1 (800 6274621) para atención de emergencias. Esta Institución hace un llamado a todas las personas para atender las recomendaciones de las autoridades de Protección Civil y pone a disposición el número telefónico 800 MARINA 1 (800 6274621) para atención de emergencias.   -HONOR, DEBER, LEALTAD, PATRIOTISMO- -HONOR, DEBER, LEALTAD, PATRIOTISMO-Puedes seleccionar más de uno. Puedes seleccionar más de uno.Puedes seleccionar más de una opción. Puedes seleccionar más de una opción.Gracias por tu opinión. Gracias por tu opinión.La legalidad, veracidad y la calidad de la información es estricta responsabilidad de la dependencia, entidad o empresa productiva del Estado que la proporcionó en virtud de sus atribuciones y/o facultades normativas. La legalidad, veracidad y la calidad de la información es estricta responsabilidad de la dependencia, entidad o empresa productiva del Estado que la proporcionó en virtud de sus atribuciones y/o facultades normativas.Es el portal único de trámites, información y participación ciudadana. Leer más Es el portal único de trámites, información y participación ciudadana. Leer más",NA
"La SEMAR continúa con Plan Marina en su Fase de Prevención por el paso del Huracán “Hilary”, Categoría 3 en la Península de Baja California.","https://www.gob.mx/semar/prensa/la-semar-continua-con-plan-marina-en-su-fase-de-prevencion-por-el-paso-del-huracan-hilary-categoria-3-en-la-peninsula-de-baja-california?idiom=es","Ciudad de México,","19 de agosto","Cabe mencionar que hasta el momento los informes de daños ocasionados en el litoral del Pacífico Mexicano, reflejan solo afectaciones menores a la población civil y a la infraestructura. Cabe mencionar que hasta el momento los informes de daños ocasionados en el litoral del Pacífico Mexicano, reflejan solo afectaciones menores a la población civil y a la infraestructura.Es importante resaltar que el archipiélago de Revillagigedo fue la primera área en recibir los efectos de este fenómeno, donde además de la caída de algunos árboles en Isla Socorro estado de Colima, se reportó la interrupción del servicio de energía eléctrica, mismo que ya fue restablecido. Es importante resaltar que el archipiélago de Revillagigedo fue la primera área en recibir los efectos de este fenómeno, donde además de la caída de algunos árboles en Isla Socorro estado de Colima, se reportó la interrupción del servicio de energía eléctrica, mismo que ya fue restablecido.Asimismo, el municipio de Los Cabos en el estado de Baja California Sur, reportó incidentes menores, principalmente en las poblaciones de San José del Cabo y Cabo San Lucas, donde se interrumpió temporalmente el servicio eléctrico de manera intencional, como medida preventiva para impedir mayores afectaciones; de igual manera, se reportan algunos encharcamientos menores y saldo blanco en materia de daños a la integridad física de los habitantes del área. Asimismo, el municipio de Los Cabos en el estado de Baja California Sur, reportó incidentes menores, principalmente en las poblaciones de San José del Cabo y Cabo San Lucas, donde se interrumpió temporalmente el servicio eléctrico de manera intencional, como medida preventiva para impedir mayores afectaciones; de igual manera, se reportan algunos encharcamientos menores y saldo blanco en materia de daños a la integridad física de los habitantes del área.Adicionalmente se registra crecimiento en el caudal de los arroyos ubicados en la porción Sur de la Península de Baja California, con afectación en carreteras de primer y segundo orden, por efectos de deslaves menores en el área de Nopoló, y en inmediaciones del poblado de San Luquitas, municipios de Loreto y Santa Rosalía, Baja California Sur respectivamente. Por lo anterior se recomienda evitar la circulación por citadas vías de comunicación y extremar precauciones en caso de transitar por razones de emergencia. Adicionalmente se registra crecimiento en el caudal de los arroyos ubicados en la porción Sur de la Península de Baja California, con afectación en carreteras de primer y segundo orden, por efectos de deslaves menores en el área de Nopoló, y en inmediaciones del poblado de San Luquitas, municipios de Loreto y Santa Rosalía, Baja California Sur respectivamente. Por lo anterior se recomienda evitar la circulación por citadas vías de comunicación y extremar precauciones en caso de transitar por razones de emergencia.Cabe resaltar que el Mando de la Segunda Región Naval con sede en Ensenada Baja California, se encuentra en fase de preparación para el paso de citado fenómeno natural, mismo que no ha tocado tierra y descendió a “Categoría 3”, manteniendo su desplazamiento hacia el Norte-Noroeste, ocasionando lluvias y tormentas eléctricas sobre la Península de Baja California y Golfo de California. Cabe resaltar que el Mando de la Segunda Región Naval con sede en Ensenada Baja California, se encuentra en fase de preparación para el paso de citado fenómeno natural, mismo que no ha tocado tierra y descendió a “Categoría 3”, manteniendo su desplazamiento hacia el Norte-Noroeste, ocasionando lluvias y tormentas eléctricas sobre la Península de Baja California y Golfo de California.Es importante destacar que el Plan Marina forma parte del Programa Nacional de Protección Civil y efectúa labores de alistamiento con los grupos de apoyo móvil de la Armada de México, en coordinación con autoridades de los tres órdenes de Gobierno y del sector privado. Es importante destacar que el Plan Marina forma parte del Programa Nacional de Protección Civil y efectúa labores de alistamiento con los grupos de apoyo móvil de la Armada de México, en coordinación con autoridades de los tres órdenes de Gobierno y del sector privado.La Secretaría de Marina a través de la Armada de México mantendrá activo el Plan Marina, para continuar apoyando a la población, no obstante, hace un llamado a todas las personas, para atender las recomendaciones de las autoridades de Protección Civil; de igual forma, para atención de emergencias, pone a disposición el número telefónico 800 MARINA 1 (800 6274621). La Secretaría de Marina a través de la Armada de México mantendrá activo el Plan Marina, para continuar apoyando a la población, no obstante, hace un llamado a todas las personas, para atender las recomendaciones de las autoridades de Protección Civil; de igual forma, para atención de emergencias, pone a disposición el número telefónico 800 MARINA 1 (800 6274621).HONOR, DEBER, LEALTAD, PATRIOTISMO HONOR, DEBER, LEALTAD, PATRIOTISMO-ooOoo- -ooOoo-Puedes seleccionar más de uno. Puedes seleccionar más de uno.Puedes seleccionar más de una opción. Puedes seleccionar más de una opción.Gracias por tu opinión. Gracias por tu opinión.La legalidad, veracidad y la calidad de la información es estricta responsabilidad de la dependencia, entidad o empresa productiva del Estado que la proporcionó en virtud de sus atribuciones y/o facultades normativas. La legalidad, veracidad y la calidad de la información es estricta responsabilidad de la dependencia, entidad o empresa productiva del Estado que la proporcionó en virtud de sus atribuciones y/o facultades normativas.Es el portal único de trámites, información y participación ciudadana. Leer más Es el portal único de trámites, información y participación ciudadana. Leer más",NA
"La Secretaría de Marina Armada de México activa el Plan Marina en su Fase de Prevención por el paso del Huracán “Hilary”","https://www.gob.mx/semar/prensa/la-secretaria-de-marina-armada-de-mexico-activa-el-plan-marina-en-su-fase-de-prevencion-por-el-paso-del-huracan-hilary?idiom=es","Ciudad de México,","18 de agosto","Cabe mencionar que, una vez que se tuvo conocimiento de que el fenómeno meteorológico impactaría en territorio mexicano, el personal naval se preparó para actuar de manera oportuna por mar, aire y tierra. Cabe mencionar que, una vez que se tuvo conocimiento de que el fenómeno meteorológico impactaría en territorio mexicano, el personal naval se preparó para actuar de manera oportuna por mar, aire y tierra.Por lo anterior, esta Institución a través del Cuartel General del Alto Mando, con sede en esta ciudad, y de la Cuarta Región Naval, con sede en La Paz, Baja California, ha desplegado 2,728 elementos, con el apoyo de 38 buques, 136 vehículos, siete ambulancias, dos helicópteros, dos aeronaves de ala fija, una cocina móvil y dos plantas potabilizadoras. Por lo anterior, esta Institución a través del Cuartel General del Alto Mando, con sede en esta ciudad, y de la Cuarta Región Naval, con sede en La Paz, Baja California, ha desplegado 2,728 elementos, con el apoyo de 38 buques, 136 vehículos, siete ambulancias, dos helicópteros, dos aeronaves de ala fija, una cocina móvil y dos plantas potabilizadoras.Asimismo, se cuenta con 3,000 despensas y 24,000 litros de agua embotellada en la Cuarta Región Naval, con el fin de ser distribuidos a la población en los municipios que presenten mayores afectaciones. De igual manera, personal perteneciente a la Unidad Naval de Protección Civil, designó a cuatro elementos para fungir como enlace con las dependencias de Protección Civil, así como dos médicos navales para atención médica de urgencias. Asimismo, se cuenta con 3,000 despensas y 24,000 litros de agua embotellada en la Cuarta Región Naval, con el fin de ser distribuidos a la población en los municipios que presenten mayores afectaciones. De igual manera, personal perteneciente a la Unidad Naval de Protección Civil, designó a cuatro elementos para fungir como enlace con las dependencias de Protección Civil, así como dos médicos navales para atención médica de urgencias.Además, como parte de las acciones preventivas implementadas ante el impacto inminente del meteoro, se evacuó a personal civil en las islas de Socorro, Margarita, Guadalupe y Coronado, aproximadamente 850 personas. Además, como parte de las acciones preventivas implementadas ante el impacto inminente del meteoro, se evacuó a personal civil en las islas de Socorro, Margarita, Guadalupe y Coronado, aproximadamente 850 personas.En coordinación con autoridades de los tres órdenes de gobierno se activaron albergues de apoyo a la población, se instaló un puente aéreo: Loreto-Guerrero Negro-Santa Rosalía; el puesto de control se instaló en Vizcaíno, Baja California Sur. Asimismo, se proporcionó seguridad a los albergues en La Paz, B.C.S., y se desplegó personal en las Estaciones Navales: Punta Abreojos, Bahía Asunción, Bahía Tortuga, Guerrero Negro, Mulegé y Loreto. En coordinación con autoridades de los tres órdenes de gobierno se activaron albergues de apoyo a la población, se instaló un puente aéreo: Loreto-Guerrero Negro-Santa Rosalía; el puesto de control se instaló en Vizcaíno, Baja California Sur. Asimismo, se proporcionó seguridad a los albergues en La Paz, B.C.S., y se desplegó personal en las Estaciones Navales: Punta Abreojos, Bahía Asunción, Bahía Tortuga, Guerrero Negro, Mulegé y Loreto.Es importante destacar que el Plan Marina forma parte del Programa Nacional de Protección Civil y efectúa en coordinación con autoridades de los tres órdenes de Gobierno y del sector privado, labores de alistamiento con los grupos de apoyo móvil de la Armada de México. Es importante destacar que el Plan Marina forma parte del Programa Nacional de Protección Civil y efectúa en coordinación con autoridades de los tres órdenes de Gobierno y del sector privado, labores de alistamiento con los grupos de apoyo móvil de la Armada de México.La Secretaría de Marina a través de la Armada de México mantendrá activo el Plan Marina, para continuar apoyando a la población, no obstante, hace un llamado a todas las personas, para atender las recomendaciones de las autoridades de Protección Civil; de igual forma, para atención de emergencias, pone a disposición el número telefónico 800 MARINA 1 (800 6274621). La Secretaría de Marina a través de la Armada de México mantendrá activo el Plan Marina, para continuar apoyando a la población, no obstante, hace un llamado a todas las personas, para atender las recomendaciones de las autoridades de Protección Civil; de igual forma, para atención de emergencias, pone a disposición el número telefónico 800 MARINA 1 (800 6274621).HONOR, DEBER, LEALTAD, PATRIOTISMO HONOR, DEBER, LEALTAD, PATRIOTISMO-ooOoo- -ooOoo-Puedes seleccionar más de uno. Puedes seleccionar más de uno.Puedes seleccionar más de una opción. Puedes seleccionar más de una opción.Gracias por tu opinión. Gracias por tu opinión.La legalidad, veracidad y la calidad de la información es estricta responsabilidad de la dependencia, entidad o empresa productiva del Estado que la proporcionó en virtud de sus atribuciones y/o facultades normativas. La legalidad, veracidad y la calidad de la información es estricta responsabilidad de la dependencia, entidad o empresa productiva del Estado que la proporcionó en virtud de sus atribuciones y/o facultades normativas.Es el portal único de trámites, información y participación ciudadana. Leer más Es el portal único de trámites, información y participación ciudadana. Leer más",NA
